{
  "experiment_id": "nft-BAYC-real",
  "contract": {
    "chain": "ethereum",
    "address": "0x1234...abcd",
    "label": "ExampleGovernor"
  },
  "functions": [
    {
      "function_name": "propose",
      "gas_estimate": 210000,
      "source_ref": "etherscan://contract/0x1234...abcd#function:propose"
    },
    {
      "function_name": "castVote",
      "gas_estimate": 95000,
      "source_ref": "etherscan://contract/0x1234...abcd#function:castVote"
    }
  ],
  "events": [
    {
      "event_name": "ProposalCreated",
      "source_ref": "etherscan://contract/0x1234...abcd#event:ProposalCreated"
    },
    {
      "event_name": "VoteCast",
      "source_ref": "etherscan://contract/0x1234...abcd#event:VoteCast"
    }
  ]
}
